{
  "artifact_id": "magnetar-2024-core-interior",
  "deterministic": true,
  "input_file": "2024_Core_Interior.ifc",
  "input_hash_sha256": "d07c7462aee22640661faed5262cf802ce0fcbc663f312961a39be92bf857050",
  "input_role": "bridge",
  "observation": {
    "entity_counts": {
      "IFCBEAM": 0,
      "IFCBUILDINGSTOREY": 15,
      "IFCCOLUMN": 0,
      "IFCDOOR": 0,
      "IFCFLOWTERMINAL": 0,
      "IFCMATERIAL": 1,
      "IFCPROPERTYSET": 25,
      "IFCROOF": 0,
      "IFCSHADINGDEVICE": 1,
      "IFCSLAB": 0,
      "IFCSPACE": 0,
      "IFCUNITASSIGNMENT": 1,
      "IFCWALL": 0,
      "IFCWINDOW": 0
    },
    "ifc_schema": "IFC4",
    "relations": {
      "IFCRELFILLSELEMENT": []
    },
    "storeys": {
      "IFCBUILDINGSTOREY": [
        [
          "Basement 1",
          "-20.000000"
        ],
        [
          "Basement 2",
          "-40.000000"
        ],
        [
          "Level 1",
          "0.000000"
        ],
        [
          "Level 10",
          "136.000000"
        ],
        [
          "Level 11",
          "151.000000"
        ],
        [
          "Level 12",
          "166.000000"
        ],
        [
          "Level 13",
          "185.500000"
        ],
        [
          "Level 3 - Wall Layouts 1",
          "31.000000"
        ],
        [
          "Level 4 - Wall Layouts 2",
          "46.000000"
        ],
        [
          "Level 4 - Wall Layouts 3",
          "61.000000"
        ],
        [
          "Level 6",
          "76.000000"
        ],
        [
          "Level 7",
          "91.000000"
        ],
        [
          "Level 8",
          "106.000000"
        ],
        [
          "Level 9",
          "121.000000"
        ],
        [
          "Mez 1-2",
          "15.000000"
        ]
      ]
    }
  },
  "observation_hash_sha256": "99e6cd7a2feceef26c8953d5f383291a6b8bece8e5fef378d510dac62a189f6c",
  "schema_version": "1.1.0",
  "semantic_surface_covered": [
    "entity_counts",
    "relations",
    "storeys"
  ],
  "unsupported_entities": [],
  "warnings": [],
  "witness_id": "ifcopenshell",
  "witness_version": "0.9.0.post1"
}
