{
  "artifact_id": "magnetar-2024-core-interior-slim",
  "deterministic": true,
  "input_file": "../IFC Exports/2024_Core_Interior_slim.ifc",
  "input_hash_sha256": "bfdf36ffb0bb768f3409d818403990e64d4c262c6780603be87f8077387ad86d",
  "input_role": "bridge",
  "observation": {
    "entity_counts": {
      "IFCBEAM": 0,
      "IFCBUILDINGSTOREY": 15,
      "IFCCOLUMN": 256,
      "IFCDOOR": 132,
      "IFCFLOWTERMINAL": 0,
      "IFCMATERIAL": 10,
      "IFCPROPERTYSET": 0,
      "IFCROOF": 0,
      "IFCSHADINGDEVICE": 20,
      "IFCSLAB": 80,
      "IFCSPACE": 116,
      "IFCUNITASSIGNMENT": 1,
      "IFCWALL": 360,
      "IFCWINDOW": 6
    },
    "ifc_schema": "IFC4",
    "relations": {
      "IFCRELFILLSELEMENT": [
        [
          "20796",
          "20827"
        ],
        [
          "20798",
          "20810"
        ],
        [
          "20798",
          "20815"
        ],
        [
          "20798",
          "20829"
        ],
        [
          "20800",
          "20813"
        ],
        [
          "20800",
          "20814"
        ],
        [
          "20800",
          "20830"
        ],
        [
          "20802",
          "20828"
        ],
        [
          "20803",
          "20821"
        ],
        [
          "20808",
          "20818"
        ],
        [
          "20809",
          "20819"
        ],
        [
          "20817",
          "20820"
        ],
        [
          "20863",
          "20865"
        ],
        [
          "20863",
          "20866"
        ],
        [
          "20897",
          "20898"
        ],
        [
          "25488",
          "25947"
        ],
        [
          "25488",
          "25953"
        ],
        [
          "25488",
          "25954"
        ],
        [
          "25491",
          "25952"
        ],
        [
          "25493",
          "25951"
        ],
        [
          "25495",
          "25950"
        ],
        [
          "25497",
          "25949"
        ],
        [
          "25943",
          "25948"
        ],
        [
          "25957",
          "25966"
        ],
        [
          "25958",
          "25965"
        ],
        [
          "25963",
          "25964"
        ],
        [
          "29853",
          "29884"
        ],
        [
          "29855",
          "29867"
        ],
        [
          "29855",
          "29872"
        ],
        [
          "29855",
          "29886"
        ],
        [
          "29857",
          "29870"
        ],
        [
          "29857",
          "29871"
        ],
        [
          "29857",
          "29887"
        ],
        [
          "29859",
          "29885"
        ],
        [
          "29860",
          "29878"
        ],
        [
          "29865",
          "29875"
        ],
        [
          "29866",
          "29876"
        ],
        [
          "29874",
          "29877"
        ],
        [
          "29920",
          "29922"
        ],
        [
          "29920",
          "29923"
        ],
        [
          "55734",
          "55765"
        ],
        [
          "55736",
          "55748"
        ],
        [
          "55736",
          "55753"
        ],
        [
          "55736",
          "55767"
        ],
        [
          "55738",
          "55751"
        ],
        [
          "55738",
          "55752"
        ],
        [
          "55738",
          "55768"
        ],
        [
          "55740",
          "55766"
        ],
        [
          "55741",
          "55759"
        ],
        [
          "55746",
          "55756"
        ],
        [
          "55747",
          "55757"
        ],
        [
          "55755",
          "55758"
        ],
        [
          "55801",
          "55803"
        ],
        [
          "55801",
          "55804"
        ],
        [
          "59314",
          "59345"
        ],
        [
          "59316",
          "59328"
        ],
        [
          "59316",
          "59333"
        ],
        [
          "59316",
          "59347"
        ],
        [
          "59318",
          "59331"
        ],
        [
          "59318",
          "59332"
        ],
        [
          "59318",
          "59348"
        ],
        [
          "59320",
          "59346"
        ],
        [
          "59321",
          "59339"
        ],
        [
          "59326",
          "59336"
        ],
        [
          "59327",
          "59337"
        ],
        [
          "59335",
          "59338"
        ],
        [
          "59381",
          "59383"
        ],
        [
          "59381",
          "59384"
        ],
        [
          "59415",
          "59416"
        ],
        [
          "60195",
          "60226"
        ],
        [
          "60197",
          "60209"
        ],
        [
          "60197",
          "60214"
        ],
        [
          "60197",
          "60228"
        ],
        [
          "60199",
          "60212"
        ],
        [
          "60199",
          "60213"
        ],
        [
          "60199",
          "60229"
        ],
        [
          "60201",
          "60227"
        ],
        [
          "60202",
          "60220"
        ],
        [
          "60207",
          "60217"
        ],
        [
          "60208",
          "60218"
        ],
        [
          "60216",
          "60219"
        ],
        [
          "60262",
          "60264"
        ],
        [
          "60262",
          "60265"
        ],
        [
          "60296",
          "60297"
        ],
        [
          "61076",
          "61107"
        ],
        [
          "61078",
          "61090"
        ],
        [
          "61078",
          "61095"
        ],
        [
          "61078",
          "61109"
        ],
        [
          "61080",
          "61093"
        ],
        [
          "61080",
          "61094"
        ],
        [
          "61080",
          "61110"
        ],
        [
          "61082",
          "61108"
        ],
        [
          "61083",
          "61101"
        ],
        [
          "61088",
          "61098"
        ],
        [
          "61089",
          "61099"
        ],
        [
          "61097",
          "61100"
        ],
        [
          "61143",
          "61145"
        ],
        [
          "61143",
          "61146"
        ],
        [
          "61177",
          "61178"
        ],
        [
          "61957",
          "61988"
        ],
        [
          "61959",
          "61971"
        ],
        [
          "61959",
          "61976"
        ],
        [
          "61959",
          "61990"
        ],
        [
          "61961",
          "61974"
        ],
        [
          "61961",
          "61975"
        ],
        [
          "61961",
          "61991"
        ],
        [
          "61963",
          "61989"
        ],
        [
          "61964",
          "61982"
        ],
        [
          "61969",
          "61979"
        ],
        [
          "61970",
          "61980"
        ],
        [
          "61978",
          "61981"
        ],
        [
          "62024",
          "62026"
        ],
        [
          "62024",
          "62027"
        ],
        [
          "62058",
          "62059"
        ],
        [
          "62838",
          "62869"
        ],
        [
          "62840",
          "62852"
        ],
        [
          "62840",
          "62857"
        ],
        [
          "62840",
          "62871"
        ],
        [
          "62842",
          "62855"
        ],
        [
          "62842",
          "62856"
        ],
        [
          "62842",
          "62872"
        ],
        [
          "62844",
          "62870"
        ],
        [
          "62845",
          "62863"
        ],
        [
          "62850",
          "62860"
        ],
        [
          "62851",
          "62861"
        ],
        [
          "62859",
          "62862"
        ],
        [
          "62905",
          "62907"
        ],
        [
          "62905",
          "62908"
        ],
        [
          "62939",
          "62940"
        ],
        [
          "63719",
          "63750"
        ],
        [
          "63721",
          "63733"
        ],
        [
          "63721",
          "63738"
        ],
        [
          "63721",
          "63752"
        ],
        [
          "63723",
          "63736"
        ],
        [
          "63723",
          "63737"
        ],
        [
          "63723",
          "63753"
        ],
        [
          "63725",
          "63751"
        ],
        [
          "80747",
          "80750"
        ]
      ]
    }
  },
  "observation_hash_sha256": "5c2d55189f9edc862582683b4da3f20c72f43194621c97f8fef6b6ee9af3bd92",
  "schema_version": "1.1.0",
  "semantic_surface_covered": [
    "entity_counts",
    "relations"
  ],
  "unsupported_entities": [],
  "warnings": [],
  "witness_id": "ifc-lite",
  "witness_version": "7.1.1"
}
